{
  "schemaVersion": 1,
  "source": "Prometheus http://192.168.0.50:9090; jobs trainpilot/node; 2s scrape; 1m CPU rate",
  "databaseInitialBytes": 9138176,
  "databaseFinalBytes": 9138176,
  "processCpuMaxPercent": 2.207,
  "processRssMaxBytes": 38043648,
  "hostCpuMaxPercent": 9.893,
  "hostRamMaxBytes": 807321600,
  "swapMaxBytes": 0,
  "sqliteErrors": 0,
  "networkDrops": 0,
  "webSocketQueueOverflows": 0,
  "temperatureMaxCelsius": 56.0,
  "thermalThrottlingEvents": 0
}
